{
  "contract": "ideia.effect-intent/1",
  "effect_intent_id": "efi_123e4567-e89b-42d3-a456-426614174000",
  "task_id": "tsk_123e4567-e89b-42d3-a456-426614174000",
  "step_id": "stp_123e4567-e89b-42d3-a456-426614174000",
  "call_id": "cal_123e4567-e89b-42d3-a456-426614174000",
  "principal_id": "prn_123e4567-e89b-42d3-a456-426614174000",
  "request_fingerprint": "sha256:0000000000000000000000000000000000000000000000000000000000000000",
  "policy_decision_id": "pdc_123e4567-e89b-42d3-a456-426614174000",
  "approval_id": "apr_123e4567-e89b-42d3-a456-426614174000",
  "effect_class": "pure",
  "precondition_snapshot_digest": "sha256:0000000000000000000000000000000000000000000000000000000000000000",
  "sandbox_profile_fingerprint": "sha256:0000000000000000000000000000000000000000000000000000000000000000",
  "capability_grant_ids": [
    "cpg_123e4567-e89b-42d3-a456-426614174000"
  ],
  "idempotency_key": "default",
  "prepared_at": "2024-01-01T00:00:00.000Z"
}
